<?xml version="1.0" encoding="UTF-8"?>
<xsd:schema xmlns:xsd="http://www.w3.org/2001/XMLSchema"
            targetNamespace="http://www.nat.vu.nl/~jsnel/Schema/TgmSchema"
            xmlns:tns="http://www.nat.vu.nl/~jsnel/Schema/TgmSchema"
            elementFormDefault="qualified" version="0.1" id="TgmSchema">
    <xsd:complexType name="Dat">
        <xsd:sequence>
            <xsd:element name="kinparPanel" type="tns:KinparPanelModel" nillable="true"></xsd:element>
            <xsd:element name="modelName" type="xsd:string" default="SpecifyModelName" nillable="true"></xsd:element>
            <xsd:element name="modType" type="xsd:string" default="kin" nillable="true"></xsd:element>
            <xsd:element name="irfparPanel" type="tns:IrfparPanelModel" nillable="true"></xsd:element>
            <xsd:element name="cohspecPanel" type="tns:CohspecPanelModel" nillable="true"></xsd:element>
            <xsd:element name="oscspecPanel" type="tns:OscspecPanelModel" nillable="true"></xsd:element>
            <xsd:element name="kMatrixPanel" type="tns:KMatrixPanelModel" nillable="true"/>
            <xsd:element name="weightParPanel" type="tns:WeightParPanelModel" nillable="true"/>
        </xsd:sequence>
    </xsd:complexType>
    <xsd:complexType name="KinparPanelModel">
        <xsd:sequence>
            <xsd:element name="positivepar" type="xsd:boolean" default="false"/>
            <xsd:element name="kinpar" type="tns:KinPar" maxOccurs="unbounded" nillable="true"></xsd:element>
            <xsd:element name="seqmod" type="xsd:boolean" default="false"/>
            <xsd:element name="nnls" nillable="true" type="xsd:boolean"/>
        </xsd:sequence>
    </xsd:complexType>
    <xsd:complexType name="KinPar">
        <xsd:sequence>
            <xsd:element name="start" type="xsd:double"></xsd:element>
            <xsd:element name="fixed" type="xsd:boolean" default="false" nillable="true"></xsd:element>
            <xsd:element name="constrained" type="xsd:boolean" default="false" nillable="true"></xsd:element>
            <xsd:sequence>
                <xsd:element name="max" type="xsd:double"></xsd:element>
                <xsd:element name="min" type="xsd:double"></xsd:element>
            </xsd:sequence>
        </xsd:sequence>
    </xsd:complexType>
    <xsd:element name="tgm">
        <xsd:complexType>
            <xsd:sequence>
                <xsd:element name="dat" type="tns:Dat" nillable="true"></xsd:element>
                <xsd:element name="panelStates" type="xsd:boolean" nillable="true" maxOccurs="unbounded"/>
            </xsd:sequence>
        </xsd:complexType>
    </xsd:element>
    <xsd:complexType name="IrfparPanelModel">
        <xsd:sequence>
            <xsd:element name="dispmufun" type="xsd:string" nillable="true"></xsd:element>
            <xsd:element name="disptaufun" type="xsd:string" nillable="true"></xsd:element>
            <xsd:element name="parmu" type="xsd:string" nillable="true"></xsd:element>
            <xsd:element name="partau" type="xsd:string" nillable="true"></xsd:element>
            <xsd:element name="parmufixed" type="xsd:boolean" default="false" nillable="true"></xsd:element>
            <xsd:element name="partaufixed" type="xsd:boolean" default="false" nillable="true"></xsd:element>
            <xsd:element name="lamda" type="xsd:double" nillable="true"></xsd:element>
            <xsd:element name="irf" type="xsd:double" maxOccurs="unbounded" default="0" nillable="true"></xsd:element>
            <xsd:element name="irftype" type="xsd:string" nillable="true"></xsd:element>
            <xsd:element name="fixed" type="xsd:boolean" default="false" maxOccurs="unbounded" nillable="true"/>
            <xsd:element name="backsweepEnabled" type="xsd:boolean" nillable="true" default="false"/>
            <xsd:element name="backsweepPeriod" type="xsd:double" nillable="true"/>
            <xsd:element name="measuredIrf" nillable="true" maxOccurs="1" type="xsd:string"/>
            <xsd:element name="mirf" type="xsd:boolean" default="false" nillable="true"></xsd:element>
            <xsd:element name="convalg" type="xsd:int" default="2" nillable="true"></xsd:element>
            <xsd:element name="reftau" type="xsd:double" nillable="true"></xsd:element>
            <xsd:element name="parmulist" nillable="true" maxOccurs="unbounded" type="xsd:double"/>
            <xsd:element name="partaulist" nillable="true" maxOccurs="unbounded" type="xsd:double"/>
            <xsd:element name="parmufixedlist" type="xsd:boolean" maxOccurs="unbounded" nillable="true"/>
            <xsd:element name="partaufixedlist" type="xsd:boolean" maxOccurs="unbounded" nillable="true"/>
        </xsd:sequence>
    </xsd:complexType>
    <xsd:complexType name="CohspecPanelModel">
        <xsd:sequence>
            <xsd:element name="cohspec" type="tns:Cohspec" nillable="true"></xsd:element>
            <xsd:element name="coh" type="xsd:string" maxOccurs="1" nillable="true"></xsd:element>
            <xsd:element name="clp0Enabled" type="xsd:boolean" nillable="true" minOccurs="1"/>
            <xsd:element name="clp0Min" nillable="true" minOccurs="1" type="xsd:double"/>
            <xsd:element name="clp0Max" minOccurs="1" nillable="true" type="xsd:double"/>

        </xsd:sequence>
    </xsd:complexType>
    <xsd:complexType name="Cohspec">
        <xsd:sequence>
            <xsd:element name="type" type="xsd:string"></xsd:element>
            <xsd:element name="set" type="xsd:boolean" default="false"></xsd:element>
            <xsd:element name="start" nillable="true" maxOccurs="unbounded" type="xsd:double"/>
            <xsd:element name="fixed" nillable="true" type="xsd:boolean" maxOccurs="unbounded"/>
        </xsd:sequence>
    </xsd:complexType>
        <xsd:complexType name="OscspecPanelModel">
        <xsd:sequence>
            <xsd:element name="oscspec" type="tns:Cohspec" nillable="true"></xsd:element>
            <xsd:element name="oscpar" type="xsd:double" maxOccurs="unbounded" nillable="true"></xsd:element>            
        </xsd:sequence>
    </xsd:complexType>
    <xsd:complexType name="Oscspec">
        <xsd:sequence>
            <xsd:element name="type" type="xsd:string"></xsd:element>
            <xsd:element name="set" type="xsd:boolean" default="false"></xsd:element>
            <xsd:element name="start" nillable="true" maxOccurs="unbounded" type="xsd:double"/>
        </xsd:sequence>
    </xsd:complexType>
    <xsd:complexType name="KMatrixPanelModel">
        <xsd:sequence>
            <xsd:element name="kMatrix" type="tns:IntMatrix"/>
            <xsd:element name="relationsMatrix" type="tns:Double2BoolMatrix" nillable="true"/>
            <xsd:element name="jVector" type="tns:JVector" maxOccurs="1" minOccurs="1" nillable="true"/>
            <xsd:element name="spectralContraints" type="tns:SpectralConstraints" nillable="true"/>
            <xsd:element name="contrainsMatrix" type="tns:Double2Matrix" nillable="true"/>
            <xsd:element name="KinScal" type="tns:KinPar" maxOccurs="unbounded" nillable="true"/>

        </xsd:sequence>
    </xsd:complexType>
    <xsd:complexType name="IntMatrix">
        <xsd:sequence>
            <xsd:element name="data" maxOccurs="unbounded" minOccurs="1" nillable="true">
                <xsd:complexType>
                    <xsd:sequence>
                        <xsd:element name="row" type="xsd:int" maxOccurs="unbounded" minOccurs="1"/>
                    </xsd:sequence>
                </xsd:complexType>
            </xsd:element>
        </xsd:sequence>
    </xsd:complexType>
    <xsd:complexType name="WeightParPanelModel">
        <xsd:sequence>
            <xsd:element name="weightpar" minOccurs="0" maxOccurs="unbounded" type="tns:WeightPar" nillable="true"/>
            <xsd:element name="poisson" type="xsd:boolean" default="false" nillable="true"></xsd:element>
        </xsd:sequence>
    </xsd:complexType>
    <xsd:complexType name="WeightPar">
        <xsd:sequence>
            <xsd:element name="min1" type="xsd:double" minOccurs="1" nillable="true"/>
            <xsd:element name="min2" type="xsd:double" minOccurs="1" nillable="true"/>
            <xsd:element name="max1" type="xsd:double" minOccurs="1" nillable="true"/>
            <xsd:element name="max2" type="xsd:double" minOccurs="1" nillable="true"/>
            <xsd:element name="weight" type="xsd:double" minOccurs="1" nillable="true"/>
        </xsd:sequence>
    </xsd:complexType>
    <xsd:complexType name="JVector">
        <xsd:sequence>
            <xsd:element name="vector" maxOccurs="unbounded" nillable="true" type="xsd:double"/>
            <xsd:element name="fixed" type="xsd:boolean" maxOccurs="unbounded" nillable="true"/>
        </xsd:sequence>
    </xsd:complexType>
    <xsd:complexType name="SpectralConstraints">
        <xsd:sequence>
            <xsd:element name="min" maxOccurs="unbounded" nillable="true" type="xsd:double"/>
            <xsd:element name="max" type="xsd:double" maxOccurs="unbounded" nillable="true"/>            
        </xsd:sequence>
    </xsd:complexType>
    <xsd:complexType name="Double2Matrix">
        <xsd:sequence>
            <xsd:element name="data" maxOccurs="unbounded" nillable="true">
                <xsd:complexType>
                    <xsd:sequence>
                        <xsd:element name="min" type="xsd:double" nillable="true" maxOccurs="unbounded"/>
                        <xsd:element name="max" type="xsd:double" maxOccurs="unbounded" nillable="true"/>
                        <xsd:element name="scal" type="xsd:double" maxOccurs="unbounded" nillable="true"/>
                    </xsd:sequence>
                </xsd:complexType>
            </xsd:element>
        </xsd:sequence>
    </xsd:complexType>
    <xsd:complexType name="Double2BoolMatrix">
        <xsd:sequence>
            <xsd:element name="data" maxOccurs="unbounded" nillable="true">
                <xsd:complexType>
                    <xsd:sequence>
                        <xsd:element name="c0" type="xsd:double" maxOccurs="unbounded" nillable="true"/>
                        <xsd:element name="c1" maxOccurs="unbounded" type="xsd:double"/>
                        <xsd:element name="c0fixed" maxOccurs="unbounded" type="xsd:boolean" nillable="true"/>
                        <xsd:element name="c1fixed" type="xsd:boolean" maxOccurs="unbounded" nillable="true"/>
                    </xsd:sequence>
                </xsd:complexType>
            </xsd:element>
        </xsd:sequence>
    </xsd:complexType>
</xsd:schema>